{
  "$schema": "./provenance.schema.json",
  "schema_version": "1.0.0",
  "tax_year": 2024,
  "generator": "scripts/gen_provenance.mjs",
  "sources_index": "sources/INDEX.md",
  "field_meanings": {
    "rule": "Catala source: the readable specification. Validated by differential testing. It is NOT a proof and must never be labelled as proved.",
    "proofs": "Lean theorems: machine-checked statements about the Lean implementation. Only these may be labelled proved, and only for what `covers` says.",
    "tests": "Differential tests (difftest/mappings): evidence that Catala and Lean agree with Direct File on scenarios. Not a proof.",
    "citations": "Law behind the rule. origin \"catala\": found in the Catala headings or comments (see found_in). origin \"curated\": added by hand in scripts/gen_provenance.mjs for human review."
  },
  "coverage": {
    "line_items": 19,
    "with_catala_rule": 19,
    "with_legal_citation_found_in_catala": 2,
    "without_legal_citation_found_in_catala": [
      "wages",
      "employer_income_subtotal",
      "interest_income",
      "total_income",
      "adjustments_to_income",
      "agi",
      "total_deductions",
      "taxable_income",
      "total_tentative_tax",
      "non_refundable_credits",
      "tax_less_non_refundable_credits",
      "total_tax",
      "total_withholding",
      "total_other_payments_refundable_credits",
      "total_payments",
      "overpayment",
      "balance_due"
    ],
    "with_legal_citation_any_origin": 19,
    "with_direct_file_fact": 19,
    "direct_file_fact_matches_line_catalog": 19,
    "with_lean_theorem": 9,
    "without_lean_theorem": [
      "wages",
      "employer_income_subtotal",
      "interest_income",
      "total_income",
      "adjustments_to_income",
      "agi",
      "standard_or_itemized_deductions",
      "total_deductions",
      "total_withholding",
      "total_other_payments_refundable_credits"
    ],
    "with_difftest": 19,
    "without_difftest": []
  },
  "lines": {
    "wages": {
      "key": "wages",
      "form": {
        "form": "1040",
        "line": "1a",
        "label": "Wages (Form W-2 box 1)",
        "pdf": {
          "path": "sources/forms-instructions/f1040--2024.pdf",
          "page": 1,
          "url": "https://www.irs.gov/pub/irs-prior/f1040--2024.pdf#page=1"
        }
      },
      "description": "Total of Form W-2 box 1 wages of the filer(s), each rounded to whole dollars.",
      "direct_file_fact": {
        "path": "/wages",
        "source": {
          "file": "catala/form_1040.catala_en",
          "line": 165
        },
        "matches_line_catalog": true,
        "line_catalog_path": "/wages"
      },
      "rule": {
        "kind": "catala",
        "status": "Readable specification in Catala, validated by differential testing against the Direct File oracle. NOT a proof.",
        "file": "catala/form_1040.catala_en",
        "scope": "Form1040",
        "variable": "wages",
        "definition": {
          "start": 323,
          "end": 323,
          "comment_start": 322
        },
        "heading": {
          "title": "Income, lines 1a to 9",
          "level": 2,
          "start": 309,
          "end": 366
        },
        "statute_heading": null,
        "depends_on": {
          "lines": [],
          "slots": []
        },
        "feeds": [
          {
            "instance": "w2",
            "file": "catala/form_w2s.catala_en",
            "scope": "FormW2s",
            "variable": "wages",
            "definition": {
              "start": 581,
              "end": 582
            },
            "heading": {
              "title": "Form 1040 lines 1a and 25a and the Schedule 8812 social security taxes",
              "start": 560,
              "end": 594
            },
            "statute_heading": null
          }
        ],
        "quirks": []
      },
      "citations": [
        {
          "id": "usc:26:61(a)(1)",
          "kind": "statute",
          "label": "26 U.S.C. § 61(a)(1)",
          "url": "https://www.govinfo.gov/link/uscode/26/61?year=2024&type=usc&link-type=html",
          "local": null,
          "origin": "curated",
          "found_in": []
        },
        {
          "id": "doc:f1040--2024.pdf#p1",
          "kind": "irs_form",
          "label": "f1040--2024.pdf p 1",
          "url": "https://www.irs.gov/pub/irs-prior/f1040--2024.pdf#page=1",
          "local": {
            "path": "sources/forms-instructions/f1040--2024.pdf",
            "page": 1
          },
          "origin": "catala",
          "found_in": [
            {
              "file": "catala/form_1040.catala_en",
              "line": 37
            },
            {
              "file": "catala/form_1040.catala_en",
              "line": 312
            },
            {
              "file": "catala/form_w2s.catala_en",
              "line": 579
            }
          ]
        }
      ],
      "proofs": {
        "kind": "lean_theorems",
        "status": "No Lean theorem covers this line. Its Lean value is checked only by differential tests.",
        "theorems": []
      },
      "lean": {
        "kind": "lean_implementation",
        "file": "lean/UsTax/Form1040.lean",
        "module": "UsTax.Form1040",
        "definition": "UsTax.Form1040.form1040",
        "field": "Form1040Out.wages",
        "binding": {
          "form": "let",
          "start": 191,
          "end": 191
        },
        "field_line": 117,
        "feeds": [
          {
            "instance": "w2",
            "file": "lean/UsTax/FormW2s.lean",
            "definition": "UsTax.FormW2s.formW2s",
            "start": 352,
            "end": 494
          }
        ]
      },
      "tests": {
        "kind": "differential_tests",
        "status": "Evidence, not proof: Catala (and Lean) outputs compared with the Direct File reference engine on scenarios. Scenario counts are deliberately not stored.",
        "difftest": [
          {
            "mapping": "calculator",
            "mapping_file": "difftest/mappings/calculator.mjs",
            "catala_scope": "Calculator",
            "catala_file": "catala/calculator.catala_en",
            "role": "whole_return",
            "report_only": false
          },
          {
            "mapping": "form_1040",
            "mapping_file": "difftest/mappings/form_1040.mjs",
            "catala_scope": "Form1040",
            "catala_file": "catala/form_1040.catala_en",
            "role": "whole_return",
            "report_only": false
          },
          {
            "mapping": "form_1040_plugged",
            "mapping_file": "difftest/mappings/form_1040_plugged.mjs",
            "catala_scope": "Form1040",
            "catala_file": "catala/form_1040.catala_en",
            "role": "whole_return",
            "report_only": false
          },
          {
            "mapping": "form_1040_unplugged",
            "mapping_file": "difftest/mappings/form_1040_unplugged.mjs",
            "catala_scope": "Form1040",
            "catala_file": "catala/form_1040.catala_en",
            "role": "whole_return",
            "report_only": true
          },
          {
            "mapping": "form_w2s",
            "mapping_file": "difftest/mappings/form_w2s.mjs",
            "catala_scope": "FormW2s",
            "catala_file": "catala/form_w2s.catala_en",
            "role": "module",
            "report_only": false
          }
        ],
        "catala_unit_tests": [
          {
            "file": "catala/tests/test_form_1040.catala_en"
          },
          {
            "file": "catala/tests/test_calculator.catala_en"
          }
        ]
      }
    },
    "employer_income_subtotal": {
      "key": "employer_income_subtotal",
      "form": {
        "form": "1040",
        "line": "1z",
        "label": "Total of lines 1a to 1h",
        "pdf": {
          "path": "sources/forms-instructions/f1040--2024.pdf",
          "page": 1,
          "url": "https://www.irs.gov/pub/irs-prior/f1040--2024.pdf#page=1"
        }
      },
      "description": "Line 1z: sum of the employer-income lines 1a to 1h (here W-2 wages plus taxable dependent care benefits), rounded to whole dollars.",
      "direct_file_fact": {
        "path": "/employerIncomeSubtotal",
        "source": {
          "file": "catala/form_1040.catala_en",
          "line": 167
        },
        "matches_line_catalog": true,
        "line_catalog_path": "/employerIncomeSubtotal"
      },
      "rule": {
        "kind": "catala",
        "status": "Readable specification in Catala, validated by differential testing against the Direct File oracle. NOT a proof.",
        "file": "catala/form_1040.catala_en",
        "scope": "Form1040",
        "variable": "employer_income_subtotal",
        "definition": {
          "start": 327,
          "end": 331,
          "comment_start": 325
        },
        "heading": {
          "title": "Income, lines 1a to 9",
          "level": 2,
          "start": 309,
          "end": 366
        },
        "statute_heading": null,
        "depends_on": {
          "lines": [],
          "slots": [
            {
              "slot": "taxable_dependent_care",
              "filled_by": "CDCC, #28"
            }
          ]
        },
        "feeds": [
          {
            "instance": "w2",
            "file": "catala/form_w2s.catala_en",
            "scope": "FormW2s",
            "variable": "primary_filer_wages",
            "definition": {
              "start": 600,
              "end": 601
            },
            "heading": {
              "title": "Per-filer wages, dependent care benefits, deferrals and HSA",
              "start": 595,
              "end": 662
            },
            "statute_heading": null
          },
          {
            "instance": "w2",
            "file": "catala/form_w2s.catala_en",
            "scope": "FormW2s",
            "variable": "secondary_filer_wages",
            "definition": {